{
  "$ref": "#/definitions/books",
  "definitions": {
    "books": {
      "type": "object",
      "properties": {
        "title": {
          "type": "string"
        },
        "kind": {
          "type": "string",
          "enum": [
            "Book",
            "Short Story"
          ]
        },
        "year": {
          "type": "string"
        },
        "description": {
          "type": "string"
        },
        "url": {
          "type": "string",
          "format": "uri"
        },
        "$schema": {
          "type": "string"
        }
      },
      "required": [
        "title",
        "kind",
        "year",
        "description"
      ],
      "additionalProperties": false
    }
  },
  "$schema": "http://json-schema.org/draft-07/schema#"
}