{
  "title": "Querido diario",
  "kind": "Short Story",
  "year": "2026",
  "description": "Querido diario: Odio la escuela. Odio la rutina. Odio a las monjas. P.D. Me odio también a mi.",
  "url": "https://marmioni.substack.com/p/querido-diario?r=5lxmvs&utm_campaign=post-expanded-share&utm_medium=web"
}
