{
  "title": "Mi Crush",
  "kind": "Short Story",
  "year": "2026",
  "description": "Pero yo aceleré porque venía medio peda y me fui directo a la zanja. Entonces llegó el rescate en forma de una mano que abrió la puerta y luego me tomó en sus brazos. En ese momento me enamoré",
  "url": "https://open.substack.com/pub/marmioni/p/mi-crush?r=5lxmvs&utm_campaign=post-expanded-share&utm_medium=web"
}
