{
  "title": "Ex Convicta",
  "kind": "Short Story",
  "year": "2026",
  "description": "Pieza ganadora del segundo premio del Concurso del Escritor de Substack, con el tema “pequeños placeres”",
  "url": "https://open.substack.com/pub/marmioni/p/ex-convicta?r=5lxmvs&utm_campaign=post&utm_medium=web"
}
