{
  "title": "El pepino y el chorizo",
  "kind": "Short Story",
  "year": "2024",
  "description": "Un pepino y un chorizo se pelean a ver quien es el nuevo rey del barrio. La doc sale encuerada en aparicion especial de la pagina 5 a la 75.",
  "url": "https://yourname.substack.com/p/placeholder-story-5"
}